ID	ProteinID	Function 	Localization
317	P49755	Cargo receptor involved in protein vesicular trafficking and quality control in the endoplasmic reticulum (ER) and Golgi (PubMed:10052452, PubMed:11726511, PubMed:16641999, PubMed:17288597, PubMed:19296914, PubMed:20427317, PubMed:21219331, PubMed:27569046). The p24 protein family is a group of transmembrane proteins that bind coat protein complex I/COPI and coat protein complex II/COPII involved in vesicular trafficking between the membranes (PubMed:10052452). Acts at the lumenal side for incorporation of secretory cargo molecules into transport vesicles and involved in vesicle coat formation at the cytoplasmic side (PubMed:20427317, PubMed:27569046). Mainly functions in the early secretory pathway and cycles between the ER, ER-Golgi intermediate compartment (ERGIC) and Golgi, mediating cargo transport through COPI and COPII-coated vesicles (PubMed:10052452, PubMed:10852829, PubMed:12237308). In COPII vesicle-mediated anterograde transport, involved in the transport of GPI-anchored proteins by acting together with TMED2 as their cargo receptor; the function specifically implies SEC24C and SEC24D of the COPII vesicle coat and lipid raft-like microdomains of the ER (PubMed:20427317, PubMed:27569046). Recognizes GPI anchors structural remodeled in the ER by the GPI inositol-deacylase/PGAP1 and the metallophosphoesterase MPPE1/PGAP5 (By similarity). In COPI vesicle-mediated retrograde transport, involved in the biogenesis of COPI vesicles and vesicle coat recruitment (PubMed:11726511). Involved in trafficking of amyloid beta A4 protein and soluble APP-beta release (independent from the modulation of gamma-secretase activity) (PubMed:17288597). Involved in the KDELR2-mediated retrograde transport of the toxin A subunit (CTX-A-K63)together with COPI and the COOH terminus of KDELR2 (By similarity). On Golgi membranes, acts as a primary receptor for ARF1-GDP, a GTP-binding protein involved in COPI-vesicle formation (PubMed:11726511). Increases coatomer-dependent GTPase-activating activity of ARFGAP2 which mediates the hydrolysis of ARF1-bound GTP and therefore modulates protein trafficking from the Golgi apparatus (PubMed:19296914). Involved in the exocytic trafficking of G protein-coupled receptors F2LR1/PAR2 (trypsin and tryspin-like enzyme receptor), OPRM1 (opioid receptor) and P2RY4 (UTD and UDP receptor) from the Golgi to the plasma membrane, thus contributing to receptor resensitization (PubMed:21219331). In addition to its cargo receptor activity, may also act as a protein channel after oligomerization, facilitating the post-translational entry of leaderless cytoplasmic cargo into the ERGIC (PubMed:32272059). Involved in the translocation into ERGIC, the vesicle entry and the secretion of leaderless cargos (lacking the secretion signal sequence), including the mature form of interleukin 1/IL-1 family members, the alpha-crystallin B chain HSPB5, the carbohydrate-binding proteins galectin-1/LGALS1 and galectin-3/LGALS3, the microtubule-associated protein Tau/MAPT, and the annexin A1/ANXA1; the translocation process is dependent on cargo protein unfolding and enhanced by chaperones HSP90AB1 and HSP90B1/GRP9 (PubMed:32272059). Could also associates with the presenilin-dependent gamma-secretase complex in order to regulate gamma-cleavages of the amyloid beta A4 protein to yield amyloid-beta 40/Abeta40 (PubMed:16641999)	Endoplasmic reticulum membrane
318	P67812	Catalytic component of the signal peptidase complex (SPC) which catalyzes the cleavage of N-terminal signal sequences from nascent proteins as they are translocated into the lumen of the endoplasmic reticulum (PubMed:34388369). Specifically cleaves N-terminal signal peptides that contain a hydrophobic alpha-helix (h-region) shorter than 18-20 amino acids (PubMed:34388369)	Endoplasmic reticulum membrane
319	Q5H8A4	Catalytic subunit of the ethanolamine phosphate transferase 2 complex that transfers an ethanolamine phosphate (EtNP) from a phosphatidylethanolamine (PE) to the 6-OH position of the second alpha-1,6-linked mannose of a 6-PEtn-alpha-D-Man-(1->2)-alpha-D-Man-(1->6)-2-PEtn-alpha-D-Man-(1->4)-alpha-D-GlcN-(1->6)-(1-radyl,2-acyl-sn-glycero-3-phospho)-2-acyl-inositol (also termed H7) intermediate to generate a 6-PEtn-alpha-D-Man-(1->2)-6-PEtn-alpha-D-Man-(1->6)-2-PEtn-alpha-D-Man-(1->4)-alpha-D-GlcN-(1->6)-(1-radyl,2-acyl-sn-glycero-3-phospho)-2-acyl-inositol (also termed H8) and participates in the eleventh step of the glycosylphosphatidylinositol-anchor biosynthesis	Endoplasmic reticulum membrane
320	Q8TEQ8	Catalytic subunit of the ethanolamine phosphate transferase 3 complex that transfers an ethanolamine phosphate (EtNP) from a phosphatidylethanolamine (PE) to the 6-OH position of the third alpha-1,2-linked mannose of an alpha-D-Man-(1->2)-alpha-D-Man-(1->6)-2-PEtn-alpha-D-Man-(1->4)-alpha-D-GlcN-(1->6)-(1-radyl,2-acyl-sn-glycero-3-phospho)-2-acyl-inositol (also termed H6) intermediate to generate a 6-PEtn-alpha-D-Man-(1->2)-alpha-D-Man-(1->6)-2-PEtn-alpha-D-Man-(1->4)-alpha-D-GlcN-(1->6)-(1-radyl,2-acyl-sn-glycero-3-phospho)-2-acyl-inositol (also termed H7) and participates in the tenth step of the glycosylphosphatidylinositol-anchor biosynthesis	Endoplasmic reticulum membrane
321	Q92643	Catalytic subunit of the glycosylphosphatidylinositol-anchor (GPI-anchor) transamidase (GPI-T) complex that catalyzes the formation of the linkage between a proprotein and a GPI-anchor and participates in GPI anchored protein biosynthesis (PubMed:10793132, PubMed:11483512, PubMed:12582175, PubMed:34576938, PubMed:35165458, PubMed:35551457, PubMed:37684232, PubMed:9356492). Recognizes diverse proproteins at a C-terminal signal peptide (CSP) region that lacks consensus sequence and replaces it with a GPI-anchor via a transamidation reaction (PubMed:35165458, PubMed:35551457, PubMed:37684232). Transamidation catalysis reaction follows a two-phase mechanism (PubMed:37684232). In the acyl-enzyme phase, the carbonyl group of the proproteins's omega-site undergoes a nucleophilic attack forming an enzyme-substrate thioester bond (PubMed:37684232). Followed by a general acid catalysis that allows CSP releasing, regenerating the carbonyl, and forming the acyl-enzyme intermediate (PubMed:37684232). In the GPI-anchor attachment phase, the amino group of the GPI-anchor's ethanolamine phosphate, the one on third mannose (EtNP3), mediates a nucleophilic attack on the carbonyl of the acyl-enzyme intermediate, replacing the CSP, allowing GPI-anchor attachment to the omega-residue, therefore forming the product and freeing the enzyme (PubMed:37684232)	Endoplasmic reticulum membrane
322	Q9BVG9	Catalyzes a base-exchange reaction in which the polar head group of phosphatidylethanolamine (PE) or phosphatidylcholine (PC) is replaced by L-serine (PubMed:19014349). Catalyzes the conversion of phosphatatidylethanolamine and does not act on phosphatidylcholine (PubMed:19014349). Can utilize both phosphatidylethanolamine (PE) plasmalogen and diacyl PE as substrate and the latter is six times better utilized, indicating the importance of an ester linkage at the sn-1 position (By similarity). Although it shows no sn-1 fatty acyl preference, exhibits significant preference towards docosahexaenoic acid (22:6n-3) compared with 18:1 or 20:4 at the sn-2 position (By similarity)	Endoplasmic reticulum membrane
323	Q9Y6K0	Catalyzes both phosphatidylcholine and phosphatidylethanolamine biosynthesis from CDP-choline and CDP-ethanolamine, respectively (PubMed:10191259, PubMed:10893425, PubMed:12216837, PubMed:37137909). Involved in protein-dependent process of phospholipid transport to distribute phosphatidyl choline to the lumenal surface (PubMed:10191259, PubMed:10893425, PubMed:12216837). Has a higher cholinephosphotransferase activity than ethanolaminephosphotransferase activity (PubMed:10191259, PubMed:12216837)	Endoplasmic reticulum membrane
324	Q8TCT9	Catalyzes intramembrane proteolysis of signal peptides that have been removed from precursors of secretory and membrane proteins, resulting in the release of the fragment from the ER membrane into the cytoplasm (PubMed:12077416). Required to generate lymphocyte cell surface (HLA-E) epitopes derived from MHC class I signal peptides (PubMed:11714810). May be necessary for the removal of the signal peptide that remains attached to the hepatitis C virus core protein after the initial proteolytic processing of the polyprotein (PubMed:12145199). Involved in the intramembrane cleavage of the integral membrane protein PSEN1 (PubMed:11714810, PubMed:12077416, PubMed:14741365). Cleaves the integral membrane protein XBP1 isoform 1 in a DERL1/RNF139-dependent manner (PubMed:25239945). May play a role in graft rejection (By similarity)	Endoplasmic reticulum membrane
325	O14735	Catalyzes the biosynthesis of phosphatidylinositol (PtdIns) as well as PtdIns:inositol exchange reaction. May thus act to reduce an excessive cellular PtdIns content. The exchange activity is due to the reverse reaction of PtdIns synthase and is dependent on CMP, which is tightly bound to the enzyme	Endoplasmic reticulum membrane
326	O95674	Catalyzes the conversion of phosphatidic acid (PA) to CDP-diacylglycerol (CDP-DAG), an essential intermediate in the synthesis of phosphatidylglycerol, cardiolipin and phosphatidylinositol (PubMed:25375833). Exhibits specificity for the nature of the acyl chains at the sn-1 and sn-2 positions in the substrate, PA and the preferred acyl chain composition is 1-stearoyl-2-arachidonoyl-sn-phosphatidic acid (PubMed:25375833). Plays an important role in regulating the growth and maturation of lipid droplets which are storage organelles at the center of lipid and energy homeostasis (PubMed:26946540, PubMed:31548309)	Endoplasmic reticulum membrane
327	Q5VV42	Catalyzes the methylthiolation of N6-threonylcarbamoyladenosine (t(6)A), leading to the formation of 2-methylthio-N6-threonylcarbamoyladenosine (ms(2)t(6)A) at position 37 in tRNAs that read codons beginning with adenine	Endoplasmic reticulum membrane
328	P37059	Catalyzes the NAD-dependent oxidation of the highly active 17beta-hydroxysteroids, such as estradiol (E2), testosterone (T), and dihydrotestosterone (DHT), to their less active forms and thus regulates the biological potency of these steroids. Oxidizes estradiol to estrone, testosterone to androstenedione, and dihydrotestosterone to 5alpha-androstan-3,17-dione. Also has 20-alpha-HSD activity	Endoplasmic reticulum membrane
329	O60725	Catalyzes the post-translational methylation of isoprenylated C-terminal cysteine residues	Endoplasmic reticulum membrane
330	Q06136	Catalyzes the reduction of 3'-oxosphinganine (3-ketodihydrosphingosine/KDS) to sphinganine (dihydrosphingosine/DHS), the second step of de novo sphingolipid biosynthesis	Endoplasmic reticulum membrane
331	Q15392	Catalyzes the reduction of the delta-24 double bond of sterol intermediates during cholesterol biosynthesis (PubMed:11519011, PubMed:21671375, PubMed:22178193, PubMed:25637936). In addition to its cholesterol-synthesizing activity, can protect cells from oxidative stress by reducing caspase 3 activity during apoptosis induced by oxidative stress (PubMed:11007892, PubMed:22010141). Also protects against amyloid-beta peptide-induced apoptosis (PubMed:11007892)	Endoplasmic reticulum membrane
332	Q53GQ0	Catalyzes the second of the four reactions of the long-chain fatty acids elongation cycle. This endoplasmic reticulum-bound enzymatic process, allows the addition of two carbons to the chain of long- and very long-chain fatty acids/VLCFAs per cycle. This enzyme has a 3-ketoacyl-CoA reductase activity, reducing 3-ketoacyl-CoA to 3-hydroxyacyl-CoA, within each cycle of fatty acid elongation. Thereby, it may participate in the production of VLCFAs of different chain lengths that are involved in multiple biological processes as precursors of membrane lipids and lipid mediators. May also catalyze the transformation of estrone (E1) into estradiol (E2) and play a role in estrogen formation	Endoplasmic reticulum membrane
333	Q9P035	Catalyzes the third of the four reactions of the long-chain fatty acids elongation cycle. This endoplasmic reticulum-bound enzymatic process, allows the addition of two carbons to the chain of long- and very long-chain fatty acids/VLCFAs per cycle. This enzyme catalyzes the dehydration of the 3-hydroxyacyl-CoA intermediate into trans-2,3-enoyl-CoA, within each cycle of fatty acid elongation. Thereby, it participates in the production of VLCFAs of different chain lengths that are involved in multiple biological processes as precursors of membrane lipids and lipid mediators. May be involved in Rac1-signaling pathways leading to the modulation of gene expression. Promotes insulin receptor/INSR autophosphorylation and is involved in INSR internalization (PubMed:25687571)	Endoplasmic reticulum membrane
334	Q96G23	Ceramide synthase that catalyzes the transfer of the acyl chain from acyl-CoA to a sphingoid base, with high selectivity toward very-long-chain fatty acyl-CoA (chain length C22-C27) (PubMed:17977534, PubMed:18165233, PubMed:18541923, PubMed:19728861, PubMed:20937905, PubMed:22144673, PubMed:22661289, PubMed:26887952, PubMed:29632068). N-acylates sphinganine and sphingosine bases to form dihydroceramides and ceramides in de novo synthesis and salvage pathways, respectively (By similarity) (PubMed:17977534, PubMed:18165233, PubMed:18541923, PubMed:19728861, PubMed:20937905, PubMed:22144673, PubMed:22661289, PubMed:26887952, PubMed:29632068). Plays a non-redundant role in the synthesis of ceramides with very-long-chain fatty acids in kidney, liver and brain. Regulates the abundance of myelin-specific sphingolipids galactosylceramide and sulfatide that affects myelin sheath architecture and motor neuron functions (By similarity)	Endoplasmic reticulum membrane
335	O95470	Cleaves phosphorylated sphingoid bases (PSBs), such as sphingosine-1-phosphate, into fatty aldehydes and phosphoethanolamine. Elevates stress-induced ceramide production and apoptosis (PubMed:11018465, PubMed:14570870, PubMed:24809814, PubMed:28165339). Required for global lipid homeostasis in liver and cholesterol homeostasis in fibroblasts. Involved in the regulation of pro-inflammatory response and neutrophil trafficking. Modulates neuronal autophagy via phosphoethanolamine production which regulates accumulation of aggregate-prone proteins such as APP (By similarity). Seems to play a role in establishing neuronal contact sites and axonal maintenance (By similarity)	Endoplasmic reticulum membrane
336	P61619	Component of SEC61 channel-forming translocon complex that mediates transport of signal peptide-containing precursor polypeptides across the endoplasmic reticulum (ER) (PubMed:12475939, PubMed:22375059, PubMed:28782633, PubMed:29719251, PubMed:32814900). Forms a ribosome receptor and a gated pore in the ER membrane, both functions required for cotranslational translocation of nascent polypeptides (PubMed:22375059, PubMed:28782633, PubMed:29719251). May cooperate with auxiliary protein SEC62, SEC63 and HSPA5/BiP to enable post-translational transport of small presecretory proteins (PubMed:22375059, PubMed:29719251). The SEC61 channel is also involved in ER membrane insertion of transmembrane proteins: it mediates membrane insertion of the first few transmembrane segments of proteins, while insertion of subsequent transmembrane regions of multi-pass membrane proteins is mediated by the multi-pass translocon (MPT) complex (PubMed:32820719, PubMed:36261522). The SEC61 channel cooperates with the translocating protein TRAM1 to import nascent proteins into the ER (PubMed:8616892). Controls the passive efflux of calcium ions from the ER lumen to the cytosol through SEC61 channel, contributing to the maintenance of cellular calcium homeostasis (PubMed:28782633). Plays a critical role in nephrogenesis, specifically at pronephros stage (By similarity)	Endoplasmic reticulum membrane
337	P60468	Component of SEC61 channel-forming translocon complex that mediates transport of signal peptide-containing precursor polypeptides across the endoplasmic reticulum (ER) (PubMed:12475939). Forms a ribosome receptor and a gated pore in the ER membrane, both functions required for cotranslational translocation of nascent polypeptides (PubMed:12475939). The SEC61 channel is also involved in ER membrane insertion of transmembrane proteins: it mediates membrane insertion of the first few transmembrane segments of proteins, while insertion of subsequent transmembrane regions of multi-pass membrane proteins is mediated by the multi-pass translocon (MPT) complex (PubMed:32820719, PubMed:36261522). The SEC61 channel cooperates with the translocating protein TRAM1 to import nascent proteins into the ER (PubMed:19121997)	Endoplasmic reticulum membrane
338	O94905	Component of the ERLIN1/ERLIN2 complex which mediates the endoplasmic reticulum-associated degradation (ERAD) of inositol 1,4,5-trisphosphate receptors (IP3Rs) such as ITPR1 (PubMed:17502376, PubMed:19240031). Promotes sterol-accelerated ERAD of HMGCR probably implicating an AMFR/gp78-containing ubiquitin ligase complex (PubMed:21343306). Involved in regulation of cellular cholesterol homeostasis by regulation the SREBP signaling pathway. May promote ER retention of the SCAP-SREBF complex (PubMed:24217618)	Endoplasmic reticulum membrane
339	O75477	Component of the ERLIN1/ERLIN2 complex which mediates the endoplasmic reticulum-associated degradation (ERAD) of inositol 1,4,5-trisphosphate receptors (IP3Rs). Involved in regulation of cellular cholesterol homeostasis by regulation the SREBP signaling pathway (PubMed:37683630). Binds cholesterol and may promote ER retention of the SCAP-SREBF complex (PubMed:24217618)	Endoplasmic reticulum membrane
340	Q96S52	Component of the glycosylphosphatidylinositol-anchor (GPI-anchor) transamidase (GPI-T) complex that catalyzes the formation of the linkage between a proprotein and a GPI-anchor and participates in GPI anchored protein biosynthesis	Endoplasmic reticulum membrane
341	Q969N2	Component of the glycosylphosphatidylinositol-anchor (GPI-anchor) transamidase (GPI-T) complex that catalyzes the formation of the linkage between a proprotein and a GPI-anchor and participates in GPI anchored protein biosynthesis (PubMed:11483512, PubMed:12582175, PubMed:28327575, PubMed:34576938, PubMed:35165458, PubMed:35551457, PubMed:36970549, PubMed:37684232). May play a crucial role in GPI-T complex assembly in the luminal layer (PubMed:35165458, PubMed:35551457). Binds GPI-anchor (PubMed:37684232)	Endoplasmic reticulum membrane
342	O43292	Component of the glycosylphosphatidylinositol-anchor (GPI-anchor) transamidase (GPI-T) complex that catalyzes the formation of the linkage between a proprotein and a GPI-anchor and participates in GPI anchored protein biosynthesis (PubMed:11483512, PubMed:29100095, PubMed:34576938, PubMed:35165458, PubMed:35551457, PubMed:37684232, PubMed:9468317). Binds GPI-anchor (PubMed:37684232)	Endoplasmic reticulum membrane
343	Q9H490	Component of the glycosylphosphatidylinositol-anchor (GPI-anchor) transamidase (GPI-T) complex that catalyzes the formation of the linkage between a proprotein and a GPI-anchor and participates in GPI anchored protein biosynthesis (PubMed:12802054, PubMed:31353022, PubMed:34576938, PubMed:35165458, PubMed:35551457, PubMed:37684232). Binds the lipid portion of GPI-anchor (PubMed:37684232). May act as an organizer in the transmembrane layer to recruit other subunits, and thus is essential for assembly of the complex (PubMed:35165458, PubMed:35551457)	Endoplasmic reticulum membrane
344	O15269	Component of the serine palmitoyltransferase multisubunit enzyme (SPT) that catalyzes the initial and rate-limiting step in sphingolipid biosynthesis by condensing L-serine and activated acyl-CoA (most commonly palmitoyl-CoA) to form long-chain bases. The SPT complex is also composed of SPTLC2 or SPTLC3 and SPTSSA or SPTSSB. Within this complex, the heterodimer with SPTLC2 or SPTLC3 forms the catalytic core (PubMed:19416851, PubMed:33558762, PubMed:36170811). The composition of the serine palmitoyltransferase (SPT) complex determines the substrate preference (PubMed:19416851, PubMed:33558762). The SPTLC1-SPTLC2-SPTSSA complex shows a strong preference for C16-CoA substrate, while the SPTLC1-SPTLC3-SPTSSA isozyme uses both C14-CoA and C16-CoA as substrates, with a slight preference for C14-CoA (PubMed:19416851, PubMed:19648650). The SPTLC1-SPTLC2-SPTSSB complex shows a strong preference for C18-CoA substrate, while the SPTLC1-SPTLC3-SPTSSB isozyme displays an ability to use a broader range of acyl-CoAs, without apparent preference (PubMed:19416851, PubMed:19648650, PubMed:33558761, PubMed:33558762). Required for adipocyte cell viability and metabolic homeostasis (By similarity)	Endoplasmic reticulum membrane
345	Q15005	Component of the signal peptidase complex (SPC) which catalyzes the cleavage of N-terminal signal sequences from nascent proteins as they are translocated into the lumen of the endoplasmic reticulum (PubMed:34388369). Enhances the enzymatic activity of SPC and facilitates the interactions between different components of the translocation site (By similarity)	Endoplasmic reticulum membrane
346	Q9Y5M8	Component of the signal recognition particle (SRP) complex receptor (SR) (By similarity). Ensures, in conjunction with the SRP complex, the correct targeting of the nascent secretory proteins to the endoplasmic reticulum membrane system (By similarity). May mediate the membrane association of SR (By similarity)	Endoplasmic reticulum membrane
347	P08240	Component of the signal recognition particle (SRP) complex receptor (SR) (PubMed:16439358). Ensures, in conjunction with the SRP complex, the correct targeting of the nascent secretory proteins to the endoplasmic reticulum membrane system (PubMed:16675701, PubMed:34020957). Forms a guanosine 5'-triphosphate (GTP)-dependent complex with the SRP subunit SRP54 (PubMed:34020957). SRP receptor compaction and GTPase rearrangement drive SRP-mediated cotranslational protein translocation into the ER (PubMed:34020957)	Endoplasmic reticulum membrane
348	P10620	Conjugation of reduced glutathione to a wide number of exogenous and endogenous hydrophobic electrophiles	Endoplasmic reticulum membrane
349	Q6NUQ4	Critical mediator, in cooperation with CASP4, of endoplasmic reticulum-stress induced apoptosis. Required or the activation of CASP4 following endoplasmic reticulum stress	Endoplasmic reticulum membrane
350	Q9UKV5	E3 ubiquitin-protein ligase that mediates the polyubiquitination of lysine and cysteine residues on target proteins, such as CD3D, CYP3A4, CFTR, INSIG1, SOAT2/ACAT2 and APOB for proteasomal degradation (PubMed:10456327, PubMed:11724934, PubMed:12670940, PubMed:19103148, PubMed:24424410, PubMed:28604676). Component of a VCP/p97-AMFR/gp78 complex that participates in the final step of endoplasmic reticulum-associated degradation (ERAD) (PubMed:10456327, PubMed:11724934, PubMed:19103148, PubMed:24424410). The VCP/p97-AMFR/gp78 complex is involved in the sterol-accelerated ERAD degradation of HMGCR through binding to the HMGCR-INSIG1 complex at the ER membrane (PubMed:16168377, PubMed:22143767). In addition, interaction of AMFR with AUP1 facilitates interaction of AMFR with ubiquitin-conjugating enzyme UBE2G2 and ubiquitin ligase RNF139, leading to sterol-induced HMGCR ubiquitination (PubMed:23223569). The ubiquitinated HMGCR is then released from the ER into the cytosol for subsequent destruction (PubMed:16168377, PubMed:22143767, PubMed:23223569). In addition to ubiquitination on lysine residues, catalyzes ubiquitination on cysteine residues: together with INSIG1, mediates polyubiquitination of SOAT2/ACAT2 at 'Cys-277', leading to its degradation when the lipid levels are low (PubMed:28604676). Catalyzes ubiquitination and subsequent degradation of INSIG1 when cells are depleted of sterols (PubMed:17043353). Mediates polyubiquitination of INSIG2 at 'Cys-215' in some tissues, leading to its degradation (PubMed:31953408). Also regulates ERAD through the ubiquitination of UBL4A a component of the BAG6/BAT3 complex (PubMed:21636303). Also acts as a scaffold protein to assemble a complex that couples ubiquitination, retranslocation and deglycosylation (PubMed:21636303). Mediates tumor invasion and metastasis as a receptor for the GPI/autocrine motility factor (PubMed:10456327). In association with LMBR1L and UBAC2, negatively regulates the canonical Wnt signaling pathway in the lymphocytes by promoting the ubiquitin-mediated degradation of CTNNB1 and Wnt receptors FZD6 and LRP6 (PubMed:31073040). Regulates NF-kappa-B and MAPK signaling pathways by mediating 'Lys-27'-linked polyubiquitination of TAB3 and promoting subsequent TAK1/MAP3K7 activation (PubMed:36593296). Required for proper lipid homeostasis (PubMed:37119330)	Endoplasmic reticulum membrane
351	Q96K19	E3 ubiquitin-protein ligase that plays an essential role in stimulus-induced inositol 1,4,5-trisphosphate receptor type 1 (ITPR1) ubiquitination and degradation via the endoplasmic reticulum-associated degradation (ERAD) pathway. Also involved in ITPR1 turnover in resting cells. Selectively inhibits the TLR3-triggered innate immune response by promoting the 'Lys-48'-linked polyubiquitination and degradation of TLR3 (PubMed:31076723)	Endoplasmic reticulum membrane
